{
  "event_id": "daily_20261002_evt_326",
  "beat": "INTL",
  "sub_beat": null,
  "headline": "After Red Sea losses, Yemen’s government forces hold the line",
  "context": "Air strikes and difficult terrain have prevented the Houthis from turning coastal gains into a wider breakthrough.",
  "article_ids": [
    "a8989759655734c54cb444e41dced928655a32cb83256a77f5b4bda8add9ce05"
  ],
  "sources": [
    {
      "source_id": "aljazeera_all",
      "name": "Al Jazeera",
      "publisher": "Al Jazeera",
      "summary": "Air strikes and difficult terrain have prevented the Houthis from turning coastal gains into a wider breakthrough.",
      "title": "After Red Sea losses, Yemen’s government forces hold the line",
      "url": "https://www.aljazeera.com/news/2026/10/1/after-red-sea-losses-yemens-government-forces-hold-the-line?traffic_source=rss",
      "published_at": "2026-10-02T03:05:25+08:00"
    }
  ],
  "source_count": 1,
  "source_tiers": [
    2
  ],
  "tw_highlight": false,
  "tw_highlight_reason": null,
  "tw_highlight_keywords": null,
  "selection_score": 8,
  "selection_reason": "source_tier_2",
  "drop_reason": "beat_limit_reached",
  "confidence": "medium",
  "single_source_warning": true,
  "opinion_level": "none",
  "claim_trace": [
    {
      "claim": "After Red Sea losses, Yemen’s government forces hold the line",
      "source_id": "aljazeera_all",
      "source_title": "After Red Sea losses, Yemen’s government forces hold the line",
      "source_url": "https://www.aljazeera.com/news/2026/10/1/after-red-sea-losses-yemens-government-forces-hold-the-line?traffic_source=rss",
      "support_type": "direct"
    }
  ]
}