{
  "event_id": "daily_20260728_evt_217",
  "beat": "INTL",
  "sub_beat": null,
  "headline": "Modi faces challenge from activists over surveillance at India youth protest - Reuters",
  "context": "Modi faces challenge from activists over surveillance at India youth protest Reuters",
  "article_ids": [
    "7023b0f5d782b02dbc67d4492c8b9a0109fb6dea2f502fe3c1ff3ddfe6a696e6"
  ],
  "sources": [
    {
      "source_id": "reuters_world_google_news",
      "name": "Reuters",
      "publisher": "Reuters",
      "summary": "Modi faces challenge from activists over surveillance at India youth protest Reuters",
      "title": "Modi faces challenge from activists over surveillance at India youth protest - Reuters",
      "url": "https://news.google.com/rss/articles/CBMitwFBVV95cUxQYmtnNFQ5YmdpX2E3WndlQzdheFpGUlJ2TldyYlRGSXBnUzBOV1dNaU13T0F5eG1YZDNZT3l0eVRoRWU5V1d2UUk1eFdEakhid1h5MzNDOXhuckNnVk9ZZVg4X0pYRF9PZmZGX010a19IbmVOT1F2aGFQWWxPc2NQaUVBQUxtNmlDVzFXT0s0NGRieE5ISGJJNHV3LUllaFdWLS1lakg4X3YwVHUwckI4bmQtLS16VVk?oc=5",
      "published_at": "2026-07-27T23:35:41+08:00"
    }
  ],
  "source_count": 1,
  "source_tiers": [
    1
  ],
  "tw_highlight": false,
  "tw_highlight_reason": null,
  "tw_highlight_keywords": null,
  "selection_score": 15,
  "selection_reason": "source_tier_1",
  "drop_reason": "beat_limit_reached",
  "confidence": "medium",
  "single_source_warning": true,
  "opinion_level": "none",
  "claim_trace": [
    {
      "claim": "Modi faces challenge from activists over surveillance at India youth protest - Reuters",
      "source_id": "reuters_world_google_news",
      "source_title": "Modi faces challenge from activists over surveillance at India youth protest - Reuters",
      "source_url": "https://news.google.com/rss/articles/CBMitwFBVV95cUxQYmtnNFQ5YmdpX2E3WndlQzdheFpGUlJ2TldyYlRGSXBnUzBOV1dNaU13T0F5eG1YZDNZT3l0eVRoRWU5V1d2UUk1eFdEakhid1h5MzNDOXhuckNnVk9ZZVg4X0pYRF9PZmZGX010a19IbmVOT1F2aGFQWWxPc2NQaUVBQUxtNmlDVzFXT0s0NGRieE5ISGJJNHV3LUllaFdWLS1lakg4X3YwVHUwckI4bmQtLS16VVk?oc=5",
      "support_type": "direct"
    }
  ]
}