{
  "event_id": "daily_20260804_evt_272",
  "beat": "INTL",
  "sub_beat": null,
  "headline": "Iran says it is in talks with Oman but not the US after Trump says negotiations to resume",
  "context": "Iran's remarks that there were no talks with the US prompts Donald Trump to issue a strong condemnation of its leadership.",
  "article_ids": [
    "0005b11c6aac99b7ea2454d3c74f63c795685df0a05e426c53e63dd648d79161"
  ],
  "sources": [
    {
      "source_id": "bbc_world",
      "name": "BBC",
      "publisher": "BBC",
      "summary": "Iran's remarks that there were no talks with the US prompts Donald Trump to issue a strong condemnation of its leadership.",
      "title": "Iran says it is in talks with Oman but not the US after Trump says negotiations to resume",
      "url": "https://www.bbc.co.uk/news/articles/c23579jzv08o?at_medium=RSS&at_campaign=rss",
      "published_at": "2026-08-04T03:42:55+08:00"
    }
  ],
  "source_count": 1,
  "source_tiers": [
    1
  ],
  "tw_highlight": false,
  "tw_highlight_reason": null,
  "tw_highlight_keywords": null,
  "selection_score": 15,
  "selection_reason": "source_tier_1",
  "drop_reason": "beat_limit_reached",
  "confidence": "medium",
  "single_source_warning": true,
  "opinion_level": "none",
  "claim_trace": [
    {
      "claim": "Iran says it is in talks with Oman but not the US after Trump says negotiations to resume",
      "source_id": "bbc_world",
      "source_title": "Iran says it is in talks with Oman but not the US after Trump says negotiations to resume",
      "source_url": "https://www.bbc.co.uk/news/articles/c23579jzv08o?at_medium=RSS&at_campaign=rss",
      "support_type": "direct"
    }
  ]
}