{
  "event_id": "daily_20260924_evt_236",
  "beat": "ARTS",
  "sub_beat": "建築",
  "headline": "Nuclear education centre within English garden among projects from Cardiff University",
  "context": "Dezeen School Shows: a centre dedicated to nuclear learning set within the historic landscape of Stowe, UK, is among the projects by students at Cardiff University. Also included is an ecology centre designed around the transparency of its AI use, and a community-driven recycling",
  "article_ids": [
    "c137edf03194d2df96bb101ec1b234d3542ef27e46836423be25f0e7a1f4e8cb"
  ],
  "sources": [
    {
      "source_id": "dezeen",
      "name": "Dezeen",
      "publisher": "Dezeen",
      "summary": "Dezeen School Shows: a centre dedicated to nuclear learning set within the historic landscape of Stowe, UK, is among the projects by students at Cardiff University. Also included is an ecology centre designed around the transparency of its AI use, and a community-driven recycling centre that gives unwanted items a second life. Cardiff University Institution: The post Nuclear education centre within English garden among projects from Cardiff University appeared first on Dezeen .",
      "title": "Nuclear education centre within English garden among projects from Cardiff University",
      "url": "https://www.dezeen.com/2026/09/23/nuclear-education-centre-english-garden-cardiff-university-schoolshows/",
      "published_at": "2026-09-23T23:00:15+08:00"
    }
  ],
  "source_count": 1,
  "source_tiers": [
    3
  ],
  "tw_highlight": false,
  "tw_highlight_reason": null,
  "tw_highlight_keywords": null,
  "selection_score": -12,
  "selection_reason": "source_tier_3; single_low_tier_source",
  "drop_reason": "beat_limit_reached",
  "confidence": "medium",
  "single_source_warning": true,
  "opinion_level": "none",
  "claim_trace": [
    {
      "claim": "Nuclear education centre within English garden among projects from Cardiff University",
      "source_id": "dezeen",
      "source_title": "Nuclear education centre within English garden among projects from Cardiff University",
      "source_url": "https://www.dezeen.com/2026/09/23/nuclear-education-centre-english-garden-cardiff-university-schoolshows/",
      "support_type": "direct"
    }
  ]
}