{
  "event_id": "daily_20260820_evt_251",
  "beat": "ECON",
  "sub_beat": null,
  "headline": "Turkey is ready to search for oil and gas in Syria, Turkish minister says - Reuters",
  "context": "Turkey is ready to search for oil and gas in Syria, Turkish minister says Reuters",
  "article_ids": [
    "05afacb538f1f72301e55bc7bcf18bf4807fb49f0efbb5cce0dfe20210251265"
  ],
  "sources": [
    {
      "source_id": "reuters_business_google_news",
      "name": "Reuters",
      "publisher": "Reuters",
      "summary": "Turkey is ready to search for oil and gas in Syria, Turkish minister says Reuters",
      "title": "Turkey is ready to search for oil and gas in Syria, Turkish minister says - Reuters",
      "url": "https://news.google.com/rss/articles/CBMirwFBVV95cUxNMlhzQTZJSXRFWEpDUkZNUHFTUG40YXNWb25WUUZFdjdRRnp6cGtCa0N1Z2YwZENkOTB6WXZQYjR2T0FVWEpRZlg4emZqTVhMVHAtVGNZWVd4X29HM09UenI4NDZ1WjhlYy1WaHFoY1hWRDFXR29rTDJpaEFlazJkRE5ldzVaWDRMYkdUbkRIa1NLTUYyd05LTDV4YUg0TXVxbkZLVklrMktiSGpCSHJz?oc=5",
      "published_at": "2026-08-20T00:58:31+08:00"
    }
  ],
  "source_count": 1,
  "source_tiers": [
    1
  ],
  "tw_highlight": false,
  "tw_highlight_reason": null,
  "tw_highlight_keywords": null,
  "selection_score": 15,
  "selection_reason": "source_tier_1",
  "drop_reason": "beat_limit_reached",
  "confidence": "medium",
  "single_source_warning": true,
  "opinion_level": "none",
  "claim_trace": [
    {
      "claim": "Turkey is ready to search for oil and gas in Syria, Turkish minister says - Reuters",
      "source_id": "reuters_business_google_news",
      "source_title": "Turkey is ready to search for oil and gas in Syria, Turkish minister says - Reuters",
      "source_url": "https://news.google.com/rss/articles/CBMirwFBVV95cUxNMlhzQTZJSXRFWEpDUkZNUHFTUG40YXNWb25WUUZFdjdRRnp6cGtCa0N1Z2YwZENkOTB6WXZQYjR2T0FVWEpRZlg4emZqTVhMVHAtVGNZWVd4X29HM09UenI4NDZ1WjhlYy1WaHFoY1hWRDFXR29rTDJpaEFlazJkRE5ldzVaWDRMYkdUbkRIa1NLTUYyd05LTDV4YUg0TXVxbkZLVklrMktiSGpCSHJz?oc=5",
      "support_type": "direct"
    }
  ]
}