{
  "event_id": "daily_20260616_evt_118",
  "beat": "INTL",
  "sub_beat": null,
  "headline": "Iran says Lebanon is integral part of peace deal with US - Reuters",
  "context": "Iran says Lebanon is integral part of peace deal with US Reuters",
  "article_ids": [
    "c9f0fea4e4765bd58e4ec9a16a86996a75fe9095ab92f82d7d379e44625a3c07"
  ],
  "sources": [
    {
      "source_id": "reuters_world_google_news",
      "name": "Reuters",
      "publisher": "Reuters",
      "summary": "Iran says Lebanon is integral part of peace deal with US Reuters",
      "title": "Iran says Lebanon is integral part of peace deal with US - Reuters",
      "url": "https://news.google.com/rss/articles/CBMipAFBVV95cUxQUGdCQi1qal96OVI5a3B6SHNkajgzN0VYSmFTOEU2TTQ5Nms4RDJkak5HSFZPeDBZMEFpLW9aN0hrOUNGc214WGhwM2FBN0xXZWVYMWVEeGxpRHVIeHpxalJ6T2FhMXM3SUFYVkFlR0ZIdG5XU2NIQXIybHZ0YkZOczI0VFAzVS10ZE05WEZ5UnNpQ0JVdzEwdEgySk1kYkc0YmQtYg?oc=5",
      "published_at": "2026-06-15T20:28:40+08:00"
    }
  ],
  "source_count": 1,
  "source_tiers": [
    1
  ],
  "tw_highlight": false,
  "tw_highlight_reason": null,
  "tw_highlight_keywords": null,
  "selection_score": -30,
  "selection_reason": "source_tier_1; same_topic_already_selected",
  "drop_reason": "beat_limit_reached",
  "confidence": "medium",
  "single_source_warning": true,
  "opinion_level": "none",
  "claim_trace": [
    {
      "claim": "Iran says Lebanon is integral part of peace deal with US - Reuters",
      "source_id": "reuters_world_google_news",
      "source_title": "Iran says Lebanon is integral part of peace deal with US - Reuters",
      "source_url": "https://news.google.com/rss/articles/CBMipAFBVV95cUxQUGdCQi1qal96OVI5a3B6SHNkajgzN0VYSmFTOEU2TTQ5Nms4RDJkak5HSFZPeDBZMEFpLW9aN0hrOUNGc214WGhwM2FBN0xXZWVYMWVEeGxpRHVIeHpxalJ6T2FhMXM3SUFYVkFlR0ZIdG5XU2NIQXIybHZ0YkZOczI0VFAzVS10ZE05WEZ5UnNpQ0JVdzEwdEgySk1kYkc0YmQtYg?oc=5",
      "support_type": "direct"
    }
  ]
}