{
  "event_id": "daily_20260827_evt_169",
  "beat": "PTS_LOCAL",
  "sub_beat": null,
  "headline": "宜蘭員山鄉代會主席林子凱 涉猥褻女助理一審遭判2年",
  "context": "宜蘭縣員山鄉民代表會主席林子凱，被指控在2023年間邀請一名女助理到服務處，卻涉嫌強行猥褻，被害人不斷拒絕仍未停止。今（26）日一審宣判，林子凱被認定強制猥褻犯行明確，判刑2年，他則喊冤強調會上訴。",
  "article_ids": [
    "e80714a5083c8919cd52263f89c46c51360f75a332e03e80a7342c921653bdcd"
  ],
  "sources": [
    {
      "source_id": "pts_news",
      "name": "公視",
      "publisher": "公視",
      "summary": "宜蘭縣員山鄉民代表會主席林子凱，被指控在2023年間邀請一名女助理到服務處，卻涉嫌強行猥褻，被害人不斷拒絕仍未停止。今（26）日一審宣判，林子凱被認定強制猥褻犯行明確，判刑2年，他則喊冤強調會上訴。",
      "title": "宜蘭員山鄉代會主席林子凱 涉猥褻女助理一審遭判2年",
      "url": "https://news.pts.org.tw/article/824254",
      "published_at": "2026-08-26T20:36:15+08:00"
    }
  ],
  "source_count": 1,
  "source_tiers": [
    "TW"
  ],
  "tw_highlight": false,
  "tw_highlight_reason": null,
  "tw_highlight_keywords": null,
  "selection_score": 15,
  "selection_reason": "source_tier_1",
  "drop_reason": "beat_limit_reached",
  "confidence": "medium",
  "single_source_warning": true,
  "opinion_level": "none",
  "claim_trace": [
    {
      "claim": "宜蘭員山鄉代會主席林子凱 涉猥褻女助理一審遭判2年",
      "source_id": "pts_news",
      "source_title": "宜蘭員山鄉代會主席林子凱 涉猥褻女助理一審遭判2年",
      "source_url": "https://news.pts.org.tw/article/824254",
      "support_type": "direct"
    }
  ]
}