{
  "event_id": "daily_20260929_evt_191",
  "beat": "INTL",
  "sub_beat": null,
  "headline": "Most Gulf bourses retreat after Trump dismisses Iranian overture - Reuters",
  "context": "Most Gulf bourses retreat after Trump dismisses Iranian overture Reuters",
  "article_ids": [
    "406699d129f9e712ce0e2a1b158e2d90e2afd59440153e1f5e2612b1e0584742"
  ],
  "sources": [
    {
      "source_id": "reuters_world_google_news",
      "name": "Reuters",
      "publisher": "Reuters",
      "summary": "Most Gulf bourses retreat after Trump dismisses Iranian overture Reuters",
      "title": "Most Gulf bourses retreat after Trump dismisses Iranian overture - Reuters",
      "url": "https://news.google.com/rss/articles/CBMisAFBVV95cUxOdlA3OUhOR3U5TUp4SHJWOHd1MFJhZ1MxNTRfZm5ZdnFsNTkzVGNEeFRBSmtsbmFRRHc0YWtETzM1VGx3NHc2a0JfanR3bGZIVEhvQ0hubEplTnA0UEJablJwOFJyUjlnNFJwM3BZVDZoU0lyZkFqcHdiVGp2R21IUVlPcGExeXdkQ0s0M3NnU1htTE85UnhaNTVTWVc3YVIwUy1sMmg4eHIxM2Zyd3loXw?oc=5",
      "published_at": "2026-09-28T21:09:23+08:00"
    }
  ],
  "source_count": 1,
  "source_tiers": [
    1
  ],
  "tw_highlight": false,
  "tw_highlight_reason": null,
  "tw_highlight_keywords": null,
  "selection_score": 15,
  "selection_reason": "source_tier_1",
  "drop_reason": "beat_limit_reached",
  "confidence": "medium",
  "single_source_warning": true,
  "opinion_level": "none",
  "claim_trace": [
    {
      "claim": "Most Gulf bourses retreat after Trump dismisses Iranian overture - Reuters",
      "source_id": "reuters_world_google_news",
      "source_title": "Most Gulf bourses retreat after Trump dismisses Iranian overture - Reuters",
      "source_url": "https://news.google.com/rss/articles/CBMisAFBVV95cUxOdlA3OUhOR3U5TUp4SHJWOHd1MFJhZ1MxNTRfZm5ZdnFsNTkzVGNEeFRBSmtsbmFRRHc0YWtETzM1VGx3NHc2a0JfanR3bGZIVEhvQ0hubEplTnA0UEJablJwOFJyUjlnNFJwM3BZVDZoU0lyZkFqcHdiVGp2R21IUVlPcGExeXdkQ0s0M3NnU1htTE85UnhaNTVTWVc3YVIwUy1sMmg4eHIxM2Zyd3loXw?oc=5",
      "support_type": "direct"
    }
  ]
}