{
  "event_id": "daily_20260808_evt_091",
  "beat": "ECON",
  "sub_beat": null,
  "headline": "BOJ's Masu among board members speaking before September policy meeting - Reuters",
  "context": "BOJ's Masu among board members speaking before September policy meeting Reuters",
  "article_ids": [
    "0d6d81eba4006ac6335f17abab480e66b944c448e9152950bed09b3da37b29de"
  ],
  "sources": [
    {
      "source_id": "reuters_world_google_news",
      "name": "Reuters",
      "publisher": "Reuters",
      "summary": "BOJ's Masu among board members speaking before September policy meeting Reuters",
      "title": "BOJ's Masu among board members speaking before September policy meeting - Reuters",
      "url": "https://news.google.com/rss/articles/CBMiwwFBVV95cUxPaHZZVVhFdEF1b1Z6TU92cWRPN0FIMUJhejdILWFycEw1MG5pTWZfcGFfbHhkekxtVlBSQkxjUndvWlNRY1VleTVwVkdiOV9FWjk1Vmp3Y0NLbVJxdUVoRnBVRW9uQ0RBUWRpUXpyblFaOVY1cm5aYTZwNDB6ZGdxSWZwTHVyMUYxVzNiclZpaUZQMlFxeDF6aE8xUjYtcEhKZ1FTa3RNdzhDeDlKejMtMmdiem5JYkJXWjRSUTlTLXMxLXc?oc=5",
      "published_at": "2026-08-07T13:55:43+08:00"
    }
  ],
  "source_count": 1,
  "source_tiers": [
    1
  ],
  "tw_highlight": false,
  "tw_highlight_reason": null,
  "tw_highlight_keywords": null,
  "selection_score": 15,
  "selection_reason": "source_tier_1",
  "drop_reason": "beat_limit_reached",
  "confidence": "medium",
  "single_source_warning": true,
  "opinion_level": "none",
  "claim_trace": [
    {
      "claim": "BOJ's Masu among board members speaking before September policy meeting - Reuters",
      "source_id": "reuters_world_google_news",
      "source_title": "BOJ's Masu among board members speaking before September policy meeting - Reuters",
      "source_url": "https://news.google.com/rss/articles/CBMiwwFBVV95cUxPaHZZVVhFdEF1b1Z6TU92cWRPN0FIMUJhejdILWFycEw1MG5pTWZfcGFfbHhkekxtVlBSQkxjUndvWlNRY1VleTVwVkdiOV9FWjk1Vmp3Y0NLbVJxdUVoRnBVRW9uQ0RBUWRpUXpyblFaOVY1cm5aYTZwNDB6ZGdxSWZwTHVyMUYxVzNiclZpaUZQMlFxeDF6aE8xUjYtcEhKZ1FTa3RNdzhDeDlKejMtMmdiem5JYkJXWjRSUTlTLXMxLXc?oc=5",
      "support_type": "direct"
    }
  ]
}