{
  "event_id": "daily_20260911_evt_059",
  "beat": "INTL",
  "sub_beat": null,
  "headline": "Watch: Do Republicans blame Trump for high oil prices?",
  "context": "The BBC's Sarah Smith is at the Republican Party's first midterms convention in Texas, taking place as oil prices rise to $100 (£74) a barrel.",
  "article_ids": [
    "4215abd337545d5f4e6b47ab3f73f8b833e6163111f9b9ae982b17a5df80cb82"
  ],
  "sources": [
    {
      "source_id": "bbc_world",
      "name": "BBC",
      "publisher": "BBC",
      "summary": "The BBC's Sarah Smith is at the Republican Party's first midterms convention in Texas, taking place as oil prices rise to $100 (£74) a barrel.",
      "title": "Watch: Do Republicans blame Trump for high oil prices?",
      "url": "https://www.bbc.co.uk/news/videos/cevw2rzlr8vo?at_medium=RSS&at_campaign=rss",
      "published_at": "2026-09-10T09:37:31+08:00"
    }
  ],
  "source_count": 1,
  "source_tiers": [
    1
  ],
  "tw_highlight": false,
  "tw_highlight_reason": null,
  "tw_highlight_keywords": null,
  "selection_score": -30,
  "selection_reason": "source_tier_1; same_topic_already_selected",
  "drop_reason": "beat_limit_reached",
  "confidence": "medium",
  "single_source_warning": true,
  "opinion_level": "none",
  "claim_trace": [
    {
      "claim": "Watch: Do Republicans blame Trump for high oil prices?",
      "source_id": "bbc_world",
      "source_title": "Watch: Do Republicans blame Trump for high oil prices?",
      "source_url": "https://www.bbc.co.uk/news/videos/cevw2rzlr8vo?at_medium=RSS&at_campaign=rss",
      "support_type": "direct"
    }
  ]
}