{
  "event_id": "daily_20260627_evt_058",
  "beat": "ARTS",
  "sub_beat": null,
  "headline": "Alannah Keyser Is Kicked Off ‘Love Island USA’ for Racial Slur",
  "context": "After Alannah Keyser made her debut on Sunday, viewers quickly found a social media video in which she uses a slur while singing.",
  "article_ids": [
    "0b41c99fe53d625b57563105a3269a8f206fe226b50eb3124f0460514bac9bd8"
  ],
  "sources": [
    {
      "source_id": "nyt_arts",
      "name": "The New York Times",
      "publisher": "The New York Times",
      "summary": "After Alannah Keyser made her debut on Sunday, viewers quickly found a social media video in which she uses a slur while singing.",
      "title": "Alannah Keyser Is Kicked Off ‘Love Island USA’ for Racial Slur",
      "url": "https://www.nytimes.com/2026/06/25/arts/television/love-island-alannah-keyser-racial-slur.html",
      "published_at": "2026-06-26T09:30:57+08:00"
    }
  ],
  "source_count": 1,
  "source_tiers": [
    2
  ],
  "tw_highlight": false,
  "tw_highlight_reason": null,
  "tw_highlight_keywords": null,
  "selection_score": 8,
  "selection_reason": "source_tier_2",
  "drop_reason": "beat_limit_reached",
  "confidence": "medium",
  "single_source_warning": true,
  "opinion_level": "none",
  "claim_trace": [
    {
      "claim": "Alannah Keyser Is Kicked Off ‘Love Island USA’ for Racial Slur",
      "source_id": "nyt_arts",
      "source_title": "Alannah Keyser Is Kicked Off ‘Love Island USA’ for Racial Slur",
      "source_url": "https://www.nytimes.com/2026/06/25/arts/television/love-island-alannah-keyser-racial-slur.html",
      "support_type": "direct"
    }
  ]
}