{
  "event_id": "daily_20260926_evt_334",
  "beat": "INTL",
  "sub_beat": null,
  "headline": "UN expands list of firms involved in illegal Israeli settlement activities",
  "context": "With addition of 61 more companies, the list now includes 214 businesses in 11 countries, most of them Israeli.",
  "article_ids": [
    "ae9c3390b65a7892b28e74a8037e3e97e99946668edb6e5ca6a3cc16c0f27612"
  ],
  "sources": [
    {
      "source_id": "aljazeera_all",
      "name": "Al Jazeera",
      "publisher": "Al Jazeera",
      "summary": "With addition of 61 more companies, the list now includes 214 businesses in 11 countries, most of them Israeli.",
      "title": "UN expands list of firms involved in illegal Israeli settlement activities",
      "url": "https://www.aljazeera.com/news/2026/9/25/un-expands-list-of-firms-involved-in-illegal-israeli-settlement-activities?traffic_source=rss",
      "published_at": "2026-09-26T03:21:57+08:00"
    }
  ],
  "source_count": 1,
  "source_tiers": [
    2
  ],
  "tw_highlight": false,
  "tw_highlight_reason": null,
  "tw_highlight_keywords": null,
  "selection_score": 8,
  "selection_reason": "source_tier_2",
  "drop_reason": "beat_limit_reached",
  "confidence": "medium",
  "single_source_warning": true,
  "opinion_level": "none",
  "claim_trace": [
    {
      "claim": "UN expands list of firms involved in illegal Israeli settlement activities",
      "source_id": "aljazeera_all",
      "source_title": "UN expands list of firms involved in illegal Israeli settlement activities",
      "source_url": "https://www.aljazeera.com/news/2026/9/25/un-expands-list-of-firms-involved-in-illegal-israeli-settlement-activities?traffic_source=rss",
      "support_type": "direct"
    }
  ]
}