{
  "event_id": "daily_20260620_evt_077",
  "beat": "ECON",
  "sub_beat": null,
  "headline": "Abu Dhabi tells buyers to load oil shipments from inside Hormuz, Bloomberg News reports - Reuters",
  "context": "Abu Dhabi tells buyers to load oil shipments from inside Hormuz, Bloomberg News reports Reuters",
  "article_ids": [
    "cf49ec85e4a1982523bd26d05bcbdf138b14d18dc390d98a44f27a2818433eff"
  ],
  "sources": [
    {
      "source_id": "reuters_business_google_news",
      "name": "Reuters",
      "publisher": "Reuters",
      "summary": "Abu Dhabi tells buyers to load oil shipments from inside Hormuz, Bloomberg News reports Reuters",
      "title": "Abu Dhabi tells buyers to load oil shipments from inside Hormuz, Bloomberg News reports - Reuters",
      "url": "https://news.google.com/rss/articles/CBMiygFBVV95cUxNbXc5VjdIU0NWS1V5ZnFKS1pxOXh5aTl4WWJDNDhGQTlXT0k3U0ZLY05QTmxQb0Fxam5oYzFWaXJjYUhFelV2YjdVSnJxV3M2S1FFcVRMamdhM0lHY19rbFp6UlRXSkZzTjllWGg2V3BKNFBldFg0T1B1TUVoRHh2UnZobEY1aUlSMlJSWkF6Z25XdXA2R3lBbWNxTG1kQlpoSnJYS2NPWnh6RFZCUmZNMk9lVGJ0c0Y5ZWU4SjV5Sk5PWVRiZzh2NTln?oc=5",
      "published_at": "2026-06-19T12:05:00+08:00"
    }
  ],
  "source_count": 1,
  "source_tiers": [
    1
  ],
  "tw_highlight": false,
  "tw_highlight_reason": null,
  "tw_highlight_keywords": null,
  "selection_score": 15,
  "selection_reason": "source_tier_1",
  "drop_reason": "beat_limit_reached",
  "confidence": "medium",
  "single_source_warning": true,
  "opinion_level": "none",
  "claim_trace": [
    {
      "claim": "Abu Dhabi tells buyers to load oil shipments from inside Hormuz, Bloomberg News reports - Reuters",
      "source_id": "reuters_business_google_news",
      "source_title": "Abu Dhabi tells buyers to load oil shipments from inside Hormuz, Bloomberg News reports - Reuters",
      "source_url": "https://news.google.com/rss/articles/CBMiygFBVV95cUxNbXc5VjdIU0NWS1V5ZnFKS1pxOXh5aTl4WWJDNDhGQTlXT0k3U0ZLY05QTmxQb0Fxam5oYzFWaXJjYUhFelV2YjdVSnJxV3M2S1FFcVRMamdhM0lHY19rbFp6UlRXSkZzTjllWGg2V3BKNFBldFg0T1B1TUVoRHh2UnZobEY1aUlSMlJSWkF6Z25XdXA2R3lBbWNxTG1kQlpoSnJYS2NPWnh6RFZCUmZNMk9lVGJ0c0Y5ZWU4SjV5Sk5PWVRiZzh2NTln?oc=5",
      "support_type": "direct"
    }
  ]
}