{
  "event_id": "daily_20260714_evt_216",
  "beat": "ARTS",
  "sub_beat": null,
  "headline": "Melbourne Symphony Wins Discrimination Case Over Gaza Comments",
  "context": "The pianist Jayson Gillham had sued the orchestra after it canceled his performance in the wake of comments he made against Israel’s war with Hamas.",
  "article_ids": [
    "35e2a3ecb036d168acf2edb6fc68bbdbd6f296ed7cebc523dd32b50ec43bc3dd"
  ],
  "sources": [
    {
      "source_id": "nyt_arts",
      "name": "The New York Times",
      "publisher": "The New York Times",
      "summary": "The pianist Jayson Gillham had sued the orchestra after it canceled his performance in the wake of comments he made against Israel’s war with Hamas.",
      "title": "Melbourne Symphony Wins Discrimination Case Over Gaza Comments",
      "url": "https://www.nytimes.com/2026/07/12/arts/music/jayson-gillham-melbourne-symphony-orchestra-gaza.html",
      "published_at": "2026-07-14T00:20:03+08:00"
    }
  ],
  "source_count": 1,
  "source_tiers": [
    2
  ],
  "tw_highlight": false,
  "tw_highlight_reason": null,
  "tw_highlight_keywords": null,
  "selection_score": 8,
  "selection_reason": "source_tier_2",
  "drop_reason": "beat_limit_reached",
  "confidence": "medium",
  "single_source_warning": true,
  "opinion_level": "none",
  "claim_trace": [
    {
      "claim": "Melbourne Symphony Wins Discrimination Case Over Gaza Comments",
      "source_id": "nyt_arts",
      "source_title": "Melbourne Symphony Wins Discrimination Case Over Gaza Comments",
      "source_url": "https://www.nytimes.com/2026/07/12/arts/music/jayson-gillham-melbourne-symphony-orchestra-gaza.html",
      "support_type": "direct"
    }
  ]
}