{
  "event_id": "daily_20260719_evt_098",
  "beat": "AI",
  "sub_beat": null,
  "headline": "Your Period Tracker Is (Probably) Spying on You",
  "context": "Plus: Russian cyberspies turn to infrastructure hacking, DHS repeatedly fails to realize it’d been hacked, a breach exposes an AI music generator’s scraping ways, and more.",
  "article_ids": [
    "229eba1cc9b2ee044c62d9058ba3c2471d39236238121252465a8420a675bda0"
  ],
  "sources": [
    {
      "source_id": "wired_ai",
      "name": "Wired",
      "publisher": "Wired",
      "summary": "Plus: Russian cyberspies turn to infrastructure hacking, DHS repeatedly fails to realize it’d been hacked, a breach exposes an AI music generator’s scraping ways, and more.",
      "title": "Your Period Tracker Is (Probably) Spying on You",
      "url": "https://www.wired.com/story/security-news-this-week-your-period-tracker-is-probably-spying-on-you/",
      "published_at": "2026-07-18T18:30:00+08:00"
    }
  ],
  "source_count": 1,
  "source_tiers": [
    2
  ],
  "tw_highlight": false,
  "tw_highlight_reason": null,
  "tw_highlight_keywords": null,
  "selection_score": 8,
  "selection_reason": "source_tier_2",
  "drop_reason": "beat_limit_reached",
  "confidence": "medium",
  "single_source_warning": true,
  "opinion_level": "none",
  "claim_trace": [
    {
      "claim": "Your Period Tracker Is (Probably) Spying on You",
      "source_id": "wired_ai",
      "source_title": "Your Period Tracker Is (Probably) Spying on You",
      "source_url": "https://www.wired.com/story/security-news-this-week-your-period-tracker-is-probably-spying-on-you/",
      "support_type": "direct"
    }
  ]
}