{
  "event_id": "daily_20260916_evt_155",
  "beat": "INTL",
  "sub_beat": null,
  "headline": "Ukraine launches offensive push in north of Donetsk region, senior commander says - Reuters",
  "context": "Ukraine launches offensive push in north of Donetsk region, senior commander says Reuters",
  "article_ids": [
    "3980c35ab1ec200c68b21d573d24bda179a17af68dab8308e1a49b82a70ac093"
  ],
  "sources": [
    {
      "source_id": "reuters_world_google_news",
      "name": "Reuters",
      "publisher": "Reuters",
      "summary": "Ukraine launches offensive push in north of Donetsk region, senior commander says Reuters",
      "title": "Ukraine launches offensive push in north of Donetsk region, senior commander says - Reuters",
      "url": "https://news.google.com/rss/articles/CBMiwAFBVV95cUxPVERkODNHQ1FVT0RUOWtZUEppaWI2VnFWTmF1U3ZiRjdERTRsNjROOE5NRGJQUVdfSzluVktJX01zQ1dPcTM5LXRyZ21pbEE0Q0FNUExHLXRsWllfeVM1V3RtSG1EX2I0RUdST2N3VnpFRXl4UkE0X2FIdlN1cUJjNW1NcExZY3c3VDEwblRielpvUVpadmpaZGkzY3R3MmFhUzZKV0tSMkt5UkJnc2RndERQdzZjb3k5VG9HaVEzalU?oc=5",
      "published_at": "2026-09-15T17:37:43+08:00"
    }
  ],
  "source_count": 1,
  "source_tiers": [
    1
  ],
  "tw_highlight": false,
  "tw_highlight_reason": null,
  "tw_highlight_keywords": null,
  "selection_score": 15,
  "selection_reason": "source_tier_1",
  "drop_reason": "beat_limit_reached",
  "confidence": "medium",
  "single_source_warning": true,
  "opinion_level": "none",
  "claim_trace": [
    {
      "claim": "Ukraine launches offensive push in north of Donetsk region, senior commander says - Reuters",
      "source_id": "reuters_world_google_news",
      "source_title": "Ukraine launches offensive push in north of Donetsk region, senior commander says - Reuters",
      "source_url": "https://news.google.com/rss/articles/CBMiwAFBVV95cUxPVERkODNHQ1FVT0RUOWtZUEppaWI2VnFWTmF1U3ZiRjdERTRsNjROOE5NRGJQUVdfSzluVktJX01zQ1dPcTM5LXRyZ21pbEE0Q0FNUExHLXRsWllfeVM1V3RtSG1EX2I0RUdST2N3VnpFRXl4UkE0X2FIdlN1cUJjNW1NcExZY3c3VDEwblRielpvUVpadmpaZGkzY3R3MmFhUzZKV0tSMkt5UkJnc2RndERQdzZjb3k5VG9HaVEzalU?oc=5",
      "support_type": "direct"
    }
  ]
}