{
  "event_id": "daily_20260701_evt_312",
  "beat": "INTL",
  "sub_beat": null,
  "headline": "EXCLUSIVE: NATO joins exercises off US coast, even as it loses political fight in Trump's Washington - Reuters",
  "context": "EXCLUSIVE: NATO joins exercises off US coast, even as it loses political fight in Trump's Washington Reuters",
  "article_ids": [
    "225c18db005bca4371d42b516b151c41a875fe0f60acabf2115f3db9133f2ec4"
  ],
  "sources": [
    {
      "source_id": "reuters_world_google_news",
      "name": "Reuters",
      "publisher": "Reuters",
      "summary": "EXCLUSIVE: NATO joins exercises off US coast, even as it loses political fight in Trump's Washington Reuters",
      "title": "EXCLUSIVE: NATO joins exercises off US coast, even as it loses political fight in Trump's Washington - Reuters",
      "url": "https://news.google.com/rss/articles/CBMisgFBVV95cUxObFdTRjVCQk00TjFPaWhGNU44dUFtYmhMRU9xZEFESHh4aWg5UjMwYm5qWFhFeFJ6YmxmRHhIS3ZDZllXY1ZMdy1EZThUX08xYzhBYU8wUkxPYXY3cGNpZFJkdmJwN0pib2FFQlROZ1BRME0zMUxVVUgzU1A1amNSWHNNNVVQbmpBM1VXWGFGWnhNMGlGZUJxaTRTV3RKbmFTTVBUa1Y0Qk1XQWR4UGcxc2N3?oc=5",
      "published_at": "2026-07-01T03:57:35+08:00"
    }
  ],
  "source_count": 1,
  "source_tiers": [
    1
  ],
  "tw_highlight": false,
  "tw_highlight_reason": null,
  "tw_highlight_keywords": null,
  "selection_score": 40,
  "selection_reason": "source_tier_1; major_geopolitical_event",
  "drop_reason": "beat_limit_reached",
  "confidence": "medium",
  "single_source_warning": true,
  "opinion_level": "none",
  "claim_trace": [
    {
      "claim": "EXCLUSIVE: NATO joins exercises off US coast, even as it loses political fight in Trump's Washington - Reuters",
      "source_id": "reuters_world_google_news",
      "source_title": "EXCLUSIVE: NATO joins exercises off US coast, even as it loses political fight in Trump's Washington - Reuters",
      "source_url": "https://news.google.com/rss/articles/CBMisgFBVV95cUxObFdTRjVCQk00TjFPaWhGNU44dUFtYmhMRU9xZEFESHh4aWg5UjMwYm5qWFhFeFJ6YmxmRHhIS3ZDZllXY1ZMdy1EZThUX08xYzhBYU8wUkxPYXY3cGNpZFJkdmJwN0pib2FFQlROZ1BRME0zMUxVVUgzU1A1amNSWHNNNVVQbmpBM1VXWGFGWnhNMGlGZUJxaTRTV3RKbmFTTVBUa1Y0Qk1XQWR4UGcxc2N3?oc=5",
      "support_type": "direct"
    }
  ]
}