{
  "event_id": "daily_20260814_evt_109",
  "beat": "ECON",
  "sub_beat": null,
  "headline": "China chip designer Kiwimoore plans Hong Kong IPO at $2 billion valuation, sources say - Reuters",
  "context": "China chip designer Kiwimoore plans Hong Kong IPO at $2 billion valuation, sources say Reuters",
  "article_ids": [
    "746da9e5ec45b9f8a854cec353d38802c59fa5fad9a7cf0af85776b06a1d9426"
  ],
  "sources": [
    {
      "source_id": "reuters_business_google_news",
      "name": "Reuters",
      "publisher": "Reuters",
      "summary": "China chip designer Kiwimoore plans Hong Kong IPO at $2 billion valuation, sources say Reuters",
      "title": "China chip designer Kiwimoore plans Hong Kong IPO at $2 billion valuation, sources say - Reuters",
      "url": "https://news.google.com/rss/articles/CBMiygFBVV95cUxNZXhTNDVLVUpyaERieWlrdjVmVXFuNTJSYm9FcGxFaktCZW81eVBSOGVtZ3BUeV9sX3VzY1BRbno5SEhvOXdHU0EtcVRnekYzNXVoNHhDejZscnRsRVFRQ0sxSng2S2JLak5hOUFWeGxCanRnYUxoVFZXZlNlZVpielBkUkhoVW9Pb19DQW1meU1OMEVvTkVmSVY2TFB1T0VFWGpaczVVbEl5WkZXRDU1bDl3Q1RZZktkdUxETTQtZ3UtcE9Yc0ZfNzB3?oc=5",
      "published_at": "2026-08-13T16:04:19+08:00"
    }
  ],
  "source_count": 1,
  "source_tiers": [
    1
  ],
  "tw_highlight": false,
  "tw_highlight_reason": null,
  "tw_highlight_keywords": null,
  "selection_score": 15,
  "selection_reason": "source_tier_1",
  "drop_reason": "beat_limit_reached",
  "confidence": "medium",
  "single_source_warning": true,
  "opinion_level": "none",
  "claim_trace": [
    {
      "claim": "China chip designer Kiwimoore plans Hong Kong IPO at $2 billion valuation, sources say - Reuters",
      "source_id": "reuters_business_google_news",
      "source_title": "China chip designer Kiwimoore plans Hong Kong IPO at $2 billion valuation, sources say - Reuters",
      "source_url": "https://news.google.com/rss/articles/CBMiygFBVV95cUxNZXhTNDVLVUpyaERieWlrdjVmVXFuNTJSYm9FcGxFaktCZW81eVBSOGVtZ3BUeV9sX3VzY1BRbno5SEhvOXdHU0EtcVRnekYzNXVoNHhDejZscnRsRVFRQ0sxSng2S2JLak5hOUFWeGxCanRnYUxoVFZXZlNlZVpielBkUkhoVW9Pb19DQW1meU1OMEVvTkVmSVY2TFB1T0VFWGpaczVVbEl5WkZXRDU1bDl3Q1RZZktkdUxETTQtZ3UtcE9Yc0ZfNzB3?oc=5",
      "support_type": "direct"
    }
  ]
}