{
  "event_id": "daily_20260725_evt_138",
  "beat": "ARTS",
  "sub_beat": "建築",
  "headline": "The Association for Community Design: Enduring Optimism Conference",
  "context": "Calling all community designers to join us for ACD49 in Bozeman, Montana! ACD49: Enduring Optimism marks the return of the Association for Community Design’s annual conference with a two-day convening on October 2-3, 2026. ACD49 is hosted by the Montana Community Design Center at",
  "article_ids": [
    "20057077b4ce617c07a5db50a6c0f4c25b93548f00a1b8dc31560fc82d706190"
  ],
  "sources": [
    {
      "source_id": "archdaily",
      "name": "ArchDaily",
      "publisher": "ArchDaily",
      "summary": "Calling all community designers to join us for ACD49 in Bozeman, Montana! ACD49: Enduring Optimism marks the return of the Association for Community Design’s annual conference with a two-day convening on October 2-3, 2026. ACD49 is hosted by the Montana Community Design Center at Montana State University. As the center marks its 50th year, this gathering reflects on the endurance of community design as both a movement and a practice. Set within Montana’s rural context and hosted at the state’s largest university, ACD49 creates space to reflect on where this work began, what has endured, and where community design must",
      "title": "The Association for Community Design: Enduring Optimism Conference",
      "url": "https://www.archdaily.com/1181592/the-association-for-community-design-enduring-optimism-conference",
      "published_at": "2026-07-24T17:15:00+08:00"
    }
  ],
  "source_count": 1,
  "source_tiers": [
    3
  ],
  "tw_highlight": false,
  "tw_highlight_reason": null,
  "tw_highlight_keywords": null,
  "selection_score": -12,
  "selection_reason": "source_tier_3; single_low_tier_source",
  "drop_reason": "beat_limit_reached",
  "confidence": "medium",
  "single_source_warning": true,
  "opinion_level": "none",
  "claim_trace": [
    {
      "claim": "The Association for Community Design: Enduring Optimism Conference",
      "source_id": "archdaily",
      "source_title": "The Association for Community Design: Enduring Optimism Conference",
      "source_url": "https://www.archdaily.com/1181592/the-association-for-community-design-enduring-optimism-conference",
      "support_type": "direct"
    }
  ]
}