{
  "event_id": "daily_20260617_evt_146",
  "beat": "INTL",
  "sub_beat": null,
  "headline": "How Israel could complicate Iran peace negotiations. And, World Cup highlights",
  "context": "Israel has been sidelined in the agreement between the U.S. and Iran. It could spoil peace negotiations. And, it's been a thrilling start to the World Cup.",
  "article_ids": [
    "8fe33104995f89985987cbf630aea26575a14d399430c2857194965cd0fd4f3b"
  ],
  "sources": [
    {
      "source_id": "npr_world",
      "name": "NPR",
      "publisher": "NPR",
      "summary": "Israel has been sidelined in the agreement between the U.S. and Iran. It could spoil peace negotiations. And, it's been a thrilling start to the World Cup.",
      "title": "How Israel could complicate Iran peace negotiations. And, World Cup highlights",
      "url": "https://www.npr.org/2026/06/16/g-s1-128341/up-first-newsletter-iran-israel-g7-primaries-luigi-mangione",
      "published_at": "2026-06-16T18:53:19+08:00"
    }
  ],
  "source_count": 1,
  "source_tiers": [
    2
  ],
  "tw_highlight": false,
  "tw_highlight_reason": null,
  "tw_highlight_keywords": null,
  "selection_score": 8,
  "selection_reason": "source_tier_2",
  "drop_reason": "beat_limit_reached",
  "confidence": "medium",
  "single_source_warning": true,
  "opinion_level": "none",
  "claim_trace": [
    {
      "claim": "How Israel could complicate Iran peace negotiations. And, World Cup highlights",
      "source_id": "npr_world",
      "source_title": "How Israel could complicate Iran peace negotiations. And, World Cup highlights",
      "source_url": "https://www.npr.org/2026/06/16/g-s1-128341/up-first-newsletter-iran-israel-g7-primaries-luigi-mangione",
      "support_type": "direct"
    }
  ]
}