{
  "event_id": "daily_20260917_evt_293",
  "beat": "INTL",
  "sub_beat": null,
  "headline": "Italy's Meloni says she aims to remain in office until end of term - Reuters",
  "context": "Italy's Meloni says she aims to remain in office until end of term Reuters",
  "article_ids": [
    "1fb0000d4788a1530a8d4f7a660b90594c37c2de4cab64465c8b570b8d7cf7d1"
  ],
  "sources": [
    {
      "source_id": "reuters_world_google_news",
      "name": "Reuters",
      "publisher": "Reuters",
      "summary": "Italy's Meloni says she aims to remain in office until end of term Reuters",
      "title": "Italy's Meloni says she aims to remain in office until end of term - Reuters",
      "url": "https://news.google.com/rss/articles/CBMinwFBVV95cUxNTXlzbnAyMkMyaTV0WDgzMnFKV0ptODBhUWZmM1F2YnFGVU9Sa2pPRm5hRkpjM1F5c3VqQ0FoRHUzdGRJTU9XTkxvX3hTSjVzc2hFVmw5bFBWTXRjdzR1a1RnNURnTWJ0YmEtaGstcHpKaUU0akpCVnhYazNia1BKODJMMzMyMkstLXNCT3o3R3FQVF9WdzZuVzdDT1hmbk0?oc=5",
      "published_at": "2026-09-17T00:48:13+08:00"
    }
  ],
  "source_count": 1,
  "source_tiers": [
    1
  ],
  "tw_highlight": false,
  "tw_highlight_reason": null,
  "tw_highlight_keywords": null,
  "selection_score": 15,
  "selection_reason": "source_tier_1",
  "drop_reason": "beat_limit_reached",
  "confidence": "medium",
  "single_source_warning": true,
  "opinion_level": "none",
  "claim_trace": [
    {
      "claim": "Italy's Meloni says she aims to remain in office until end of term - Reuters",
      "source_id": "reuters_world_google_news",
      "source_title": "Italy's Meloni says she aims to remain in office until end of term - Reuters",
      "source_url": "https://news.google.com/rss/articles/CBMinwFBVV95cUxNTXlzbnAyMkMyaTV0WDgzMnFKV0ptODBhUWZmM1F2YnFGVU9Sa2pPRm5hRkpjM1F5c3VqQ0FoRHUzdGRJTU9XTkxvX3hTSjVzc2hFVmw5bFBWTXRjdzR1a1RnNURnTWJ0YmEtaGstcHpKaUU0akpCVnhYazNia1BKODJMMzMyMkstLXNCT3o3R3FQVF9WdzZuVzdDT1hmbk0?oc=5",
      "support_type": "direct"
    }
  ]
}