{
  "event_id": "daily_20260617_evt_118",
  "beat": "ARTS",
  "sub_beat": "建築",
  "headline": "\"As so often seems to happen, Koolhaas got there first\"",
  "context": "Following the surprise success of architectural horror flick Backrooms, Edwin Heathcote considers the basis for our morbid fascination with endless corporate spaces. Is it only me, or do we all have that dream about finding a secret door in our too-small apartment that leads to a",
  "article_ids": [
    "439416fcb08093e922c13d24fef22d1b21d221d7315bfec3b22880613515ba7e"
  ],
  "sources": [
    {
      "source_id": "dezeen",
      "name": "Dezeen",
      "publisher": "Dezeen",
      "summary": "Following the surprise success of architectural horror flick Backrooms, Edwin Heathcote considers the basis for our morbid fascination with endless corporate spaces. Is it only me, or do we all have that dream about finding a secret door in our too-small apartment that leads to another room, a corridor, or perhaps a whole basement? It's The post \"As so often seems to happen, Koolhaas got there first\" appeared first on Dezeen .",
      "title": "\"As so often seems to happen, Koolhaas got there first\"",
      "url": "https://www.dezeen.com/2026/06/16/backrooms-movie-edwin-heathcote-opinion/",
      "published_at": "2026-06-16T17:00:08+08:00"
    }
  ],
  "source_count": 1,
  "source_tiers": [
    3
  ],
  "tw_highlight": false,
  "tw_highlight_reason": null,
  "tw_highlight_keywords": null,
  "selection_score": -12,
  "selection_reason": "source_tier_3; single_low_tier_source",
  "drop_reason": "beat_limit_reached",
  "confidence": "medium",
  "single_source_warning": true,
  "opinion_level": "none",
  "claim_trace": [
    {
      "claim": "\"As so often seems to happen, Koolhaas got there first\"",
      "source_id": "dezeen",
      "source_title": "\"As so often seems to happen, Koolhaas got there first\"",
      "source_url": "https://www.dezeen.com/2026/06/16/backrooms-movie-edwin-heathcote-opinion/",
      "support_type": "direct"
    }
  ]
}