{
  "event_id": "daily_20260726_evt_080",
  "beat": "ARTS",
  "sub_beat": null,
  "headline": "The perfect books for the beach … picked by Freida McFadden, Mick Herron, Robert Harris and more",
  "context": "From a transporting historical saga to a tale of small-town betrayal, the authors of our favourite page-turners reveal the books they take on holiday – introduced by Jenny Colgan It is important to follow a balanced diet on holiday. Too many “My Wife’s Sister’s Husband’s Psychopa",
  "article_ids": [
    "d79bb412a7fd5b94004a36cb1b764c8d9607c76b14ab2ab1ded438f62f27a008"
  ],
  "sources": [
    {
      "source_id": "guardian_culture",
      "name": "The Guardian",
      "publisher": "The Guardian",
      "summary": "From a transporting historical saga to a tale of small-town betrayal, the authors of our favourite page-turners reveal the books they take on holiday – introduced by Jenny Colgan It is important to follow a balanced diet on holiday. Too many “My Wife’s Sister’s Husband’s Psychopath”, and you’ll get confused and grumpy. Too much sugary romance and your teeth will fall out. Something too big and challenging you’ve been meaning to get round to for ages will make you feel guilty and more liable to give in to scrolling, and if you take too many supposedly upmarket “must reads” of the summer, you will simply prove to yourself just how much overhyped averageness there is out there, when all you want is something satisfying. You need to be able to chop and change depending on your mood, which means fiction and nonfiction. And finally, you need to be able to throw all of these rules out of the window if you find a sandy old water-stained copy of, for example, James Herbert’s Domain in your holiday cottage and decide to devote yourself to 600 pages of post-nuclear mutant rat-strewn London, or choose to go for a full-on Maeve Binchy sesh. Continue reading...",
      "title": "The perfect books for the beach … picked by Freida McFadden, Mick Herron, Robert Harris and more",
      "url": "https://www.theguardian.com/books/ng-interactive/2026/jul/25/the-perfect-books-for-the-beach-picked-by-freida-mcfadden-mick-herron-robert-harris-and-more",
      "published_at": "2026-07-25T16:00:36+08:00"
    }
  ],
  "source_count": 1,
  "source_tiers": [
    2
  ],
  "tw_highlight": false,
  "tw_highlight_reason": null,
  "tw_highlight_keywords": null,
  "selection_score": 8,
  "selection_reason": "source_tier_2",
  "drop_reason": "beat_limit_reached",
  "confidence": "medium",
  "single_source_warning": true,
  "opinion_level": "none",
  "claim_trace": [
    {
      "claim": "The perfect books for the beach … picked by Freida McFadden, Mick Herron, Robert Harris and more",
      "source_id": "guardian_culture",
      "source_title": "The perfect books for the beach … picked by Freida McFadden, Mick Herron, Robert Harris and more",
      "source_url": "https://www.theguardian.com/books/ng-interactive/2026/jul/25/the-perfect-books-for-the-beach-picked-by-freida-mcfadden-mick-herron-robert-harris-and-more",
      "support_type": "direct"
    }
  ]
}